{
  "required" : true ,
  "$schema" : "http://json-schema.org/draft-03/schema" ,
  "type" : "object" ,
  "properties" : {
    "_links" : {
      "type" : "object" ,
      "required" : false ,
      "properties" : {
        "self" : {
          "type" : "string" ,
          "required" : false
        }
      }
    } ,
    "updated_at" : {
      "type" : "string" ,
      "required" : false
    } ,
    "user" : {
      "type" : "object" ,
      "required" : false ,
      "properties" : {
        "_links" : {
          "type" : "object" ,
          "required" : false ,
          "properties" : {
            "self" : {
              "type" : "string" ,
              "required" : false
            }
          }
        } ,
        "updated_at" : {
          "type" : "string" ,
          "required" : false
        } ,
        "logo" : {
          "type" : "string" ,
          "required" : false
        } ,
        "staff" : {
          "type" : "boolean" ,
          "required" : false
        } ,
        "display_name" : {
          "type" : "string" ,
          "required" : false
        } ,
        "name" : {
          "type" : "string" ,
          "required" : false
        } ,
        "_id" : {
          "type" : "number" ,
          "required" : false
        } ,
        "created_at" : {
          "type" : "string" ,
          "required" : false
        }
      }
    } ,
    "_id" : {
      "type" : "number" ,
      "required" : false
    }
  }
}